{"artifactId":"fixture-agent@0.1.0","artifacts":[{"path":"agent-genome.json","sha256":"29c596faf6f7768479f04b1e931bc747c25318e0debb730ec11324f4f9ea6afa"},{"path":"prompt-os-artifact.md","sha256":"37565dc53d9dec1f2711b0f5d7740330877cef0ac074bf3b98e906672e55b622"},{"path":"realm-contract.json","sha256":"69e56d771174bfdd823c262a8a68f3f1abf98c69dc8d4645d43a23cf29dfda1f"}],"buildId":"31d29b12d3747e8190ee1d5590f7cdb1b506a96208f6e98093174acd3c74fc33","compatibility":{"cortexAdapters":["fixture-a","fixture-b"],"realmIds":["fixture-workbench"],"schemaRange":"1"},"genomeDigest":"29c596faf6f7768479f04b1e931bc747c25318e0debb730ec11324f4f9ea6afa","omittedComponents":["soul-runtime"],"resolvedComponents":["genome","prompt-os","realm"],"schemaVersion":1,"sources":[{"path":"agent-genome.json","role":"genome","sha256":"29c596faf6f7768479f04b1e931bc747c25318e0debb730ec11324f4f9ea6afa"},{"path":"prompt-os-artifact.md","role":"prompt-os","sha256":"37565dc53d9dec1f2711b0f5d7740330877cef0ac074bf3b98e906672e55b622"},{"path":"realm-contract.json","role":"realm","sha256":"69e56d771174bfdd823c262a8a68f3f1abf98c69dc8d4645d43a23cf29dfda1f"}],"validations":[{"id":"agent-genome-schema","status":"pass"},{"id":"prompt-os-metadata","status":"pass"},{"id":"realm-contract-schema","status":"pass"},{"id":"realm-capabilities","status":"pass"},{"id":"soul-port-dormant","status":"pass"}]}
