{"artifactId":"networked-fixture-agent@0.2.0","artifacts":[{"path":"agent-genome.json","sha256":"75e86a12d9a7c07679b2e45a2c0148f40ee769e1609aea61c6a5fa1e95d0e3ab"},{"path":"prompt-os-artifact.md","sha256":"37565dc53d9dec1f2711b0f5d7740330877cef0ac074bf3b98e906672e55b622"},{"path":"realm-contract.json","sha256":"2b23b606c91b883c515cfe4f7b3c6948341d6ab5d42b5e99d8b0a83d3b83af78"}],"buildId":"f01161b0a89af6f54d8a4f3e2d99a2bb49f088812ddab92788dcae80f176e047","compatibility":{"cortexAdapters":["openai-compatible-v1"],"realmIds":["fixture-workbench"],"schemaRange":"1"},"genomeDigest":"75e86a12d9a7c07679b2e45a2c0148f40ee769e1609aea61c6a5fa1e95d0e3ab","omittedComponents":["soul-runtime"],"resolvedComponents":["genome","prompt-os","realm"],"schemaVersion":1,"sources":[{"path":"agent-genome.json","role":"genome","sha256":"75e86a12d9a7c07679b2e45a2c0148f40ee769e1609aea61c6a5fa1e95d0e3ab"},{"path":"prompt-os-artifact.md","role":"prompt-os","sha256":"37565dc53d9dec1f2711b0f5d7740330877cef0ac074bf3b98e906672e55b622"},{"path":"realm-contract.json","role":"realm","sha256":"2b23b606c91b883c515cfe4f7b3c6948341d6ab5d42b5e99d8b0a83d3b83af78"}],"validations":[{"id":"agent-genome-schema","status":"pass"},{"id":"prompt-os-metadata","status":"pass"},{"id":"realm-contract-schema","status":"pass"},{"id":"realm-capabilities","status":"pass"},{"id":"soul-port-dormant","status":"pass"}]}
